"カード名","マナコスト","タイプ","テキスト","オラクル","Ｐ／Ｔ","忠誠度","フレーバ","イラスト","セット等","再録"
"屍体の攪拌/Corpse Churn （したいのかくはん） ","(１)(黒)","インスタント ","あなたのライブラリーの一番上から３枚のカードをあなたの墓地に置く。その後、あなたはあなたの墓地からクリーチャー・カード１枚をあなたの手札に戻してもよい。","Put the top three cards of your library into your graveyard, then you may return a creature card from your graveyard to your hand.",-,-,,"Magali Villeneuve","コモン, ゲートウォッチの誓い (83/184) ",-
"ドラーナに選ばれし者/Drana's Chosen （どらーなにえらばれしもの） ","(３)(黒)","クリーチャー — 吸血鬼(Vampire)・シャーマン(Shaman)・同盟者(Ally) ","盟友 ― (Ｔ),あなたがコントロールするアンタップ状態の同盟者(Ally)を１体タップする：黒の2/2のゾンビ(Zombie)・クリーチャー・トークンを１体タップ状態で戦場に出す。","Cohort --- {T}, Tap an untapped Ally you control: Put a 2/2 black Zombie creature token onto the battlefield tapped.",2/2,-,,"Deruchenko Alexander","レア, ゲートウォッチの誓い (84/184) ",-
"闇の掌握/Grasp of Darkness （やみのしょうあく） ","(黒)(黒)","インスタント ","クリーチャー１体を対象とする。ターン終了時まで、それは-4/-4の修整を受ける。","Target creature gets -4/-4 until end of turn.",-,-,,Daarken,"アンコモン, ゲートウォッチの誓い (85/184) ","OGW SOM "
"ゲトの裏切り者、カリタス/Kalitas, Traitor of Ghet （げとのうらぎりものかりたす） ","(２)(黒)(黒)","伝説のクリーチャー — 吸血鬼(Vampire)・戦士(Warrior) ","絆魂対戦相手がコントロールするトークンでないクリーチャーが１体死亡するなら、代わりにそのカードを追放し、黒の2/2のゾンビ(Zombie)・クリーチャー・トークンを１体戦場に出す。(２)(黒),他の吸血鬼(Vampire)かゾンビを１体生け贄に捧げる：ゲトの裏切り者、カリタスの上に+1/+1カウンターを２個置く。","LifelinkIf a nontoken creature an opponent controls would die, instead exile that card and put a 2/2 black Zombie creature token onto the battlefield.{2}{B}, Sacrifice another Vampire or Zombie: Put two +1/+1 counters on Kalitas, Traitor of Ghet.",3/4,-,,"Todd Lockwood","神話レア, ゲートウォッチの誓い (86/184) ",-
"マラキールの占い師/Malakir Soothsayer （まらきーるのうらないし） ","(４)(黒)","クリーチャー — 吸血鬼(Vampire)・シャーマン(Shaman)・同盟者(Ally) ","盟友 ― (Ｔ),あなたがコントロールするアンタップ状態の同盟者(Ally)を１体タップする：あなたはカードを１枚引き、１点のライフを失う。","Cohort --- {T}, Tap an untapped Ally you control: You draw a card and you lose 1 life.",4/4,-,,"Greg Opalinski","アンコモン, ゲートウォッチの誓い (87/184) ",-
"虚身呼び/Null Caller （きょしんよび） ","(３)(黒)","クリーチャー — 吸血鬼(Vampire)・シャーマン(Shaman) ","(３)(黒),あなたの墓地からクリーチャー・カード１枚を追放する：黒の2/2のゾンビ(Zombie)・クリーチャー・トークンを１体タップ状態で戦場に出す。","{3}{B}, Exile a creature card from your graveyard: Put a 2/2 black Zombie creature token onto the battlefield tapped.",2/4,-,,"Darek Zabrocki","アンコモン, ゲートウォッチの誓い (88/184) ",-
"無情な処罰/Remorseless Punishment （むじょうなしょばつ） ","(３)(黒)(黒)","ソーサリー ","対戦相手１人を対象とする。そのプレイヤーは、カードを２枚捨てるか、クリーチャー１体かプレインズウォーカー１体を生け贄に捧げないかぎり、５点のライフを失う。この手順をもう１回繰り返す。","Target opponent loses 5 life unless that player discards two cards or sacrifices a creature or planeswalker. Repeat this process once.",-,-,,"Ryan Barger","レア, ゲートウォッチの誓い (89/184) ",-
"タールの罠/Tar Snare （たーるのわな） ","(２)(黒)","インスタント ","クリーチャー１体を対象とする。ターン終了時まで、それは-3/-2の修整を受ける。","Target creature gets -3/-2 until end of turn.",-,-,,"Karl Kopinski","コモン, ゲートウォッチの誓い (90/184) ",-
"荒々しい渇望/Untamed Hunger （あらあらしいかつぼう） ","(２)(黒)","エンチャント — オーラ(Aura) ","エンチャント（クリーチャー）エンチャントされているクリーチャーは、+2/+1の修整を受けるとともに威迫を持つ。（それは２体以上のクリーチャーによってしかブロックされない。）","Enchant creatureEnchanted creature gets +2/+1 and has menace. （It can't be blocked except by two or more creatures.）",-,-,,"Willian Murai","コモン, ゲートウォッチの誓い (91/184) ",-
"吸血鬼の特使/Vampire Envoy （きゅうけつきのとくし） ","(２)(黒)","クリーチャー — 吸血鬼(Vampire)・クレリック(Cleric)・同盟者(Ally) ","飛行吸血鬼の特使がタップ状態になるたび、あなたは１点のライフを得る。","FlyingWhenever Vampire Envoy becomes tapped, you gain 1 life.",1/4,-,,"Johannes Voss","コモン, ゲートウォッチの誓い (92/184) ",-
"ズーラポートの鎖魔道士/Zulaport Chainmage （ずーらぽーとのくさりまどうし） ","(３)(黒)","クリーチャー — 人間(Human)・シャーマン(Shaman)・同盟者(Ally) ","盟友 ― (Ｔ),あなたがコントロールするアンタップ状態の同盟者(Ally)を１体タップする：対戦相手１人を対象とする。そのプレイヤーは２点のライフを失う。","Cohort --- {T}, Tap an untapped Ally you control: Target opponent loses 2 life.",4/2,-,,"Chris Rallis","コモン, ゲートウォッチの誓い (93/184) ",-
"破壊的陥没孔/Consuming Sinkhole （はかいてきかんぼつこう） ","(３)(赤)","インスタント ","欠色（このカードは無色である。）以下から１つを選ぶ。・土地・クリーチャー１体を対象とし、それを追放する。・プレイヤー１人を対象とする。破壊的陥没孔はそのプレイヤーに４点のダメージを与える。","Devoid （This card has no color.）Choose one ---• Exile target land creature.• Consuming Sinkhole deals 4 damage to target player.",-,-,,"Igor Kieryluk","コモン, ゲートウォッチの誓い (94/184) ",-
"攻性エルドラージ/Eldrazi Aggressor （こうせいえるどらーじ） ","(２)(赤)","クリーチャー — エルドラージ(Eldrazi)・ドローン(Drone) ","欠色（このカードは無色である。）あなたが他の無色のクリーチャーをコントロールしているかぎり、攻性エルドラージは速攻を持つ。","Devoid （This card has no color.）Eldrazi Aggressor has haste as long as you control another colorless creature.",2/3,-,,"Mathias Kollros","コモン, ゲートウォッチの誓い (95/184) ",-
"エルドラージの寸借者/Eldrazi Obligator （えるどらーじのすんしゃくしゃ） ","(２)(赤)","クリーチャー — エルドラージ(Eldrazi) ","欠色（このカードは無色である。）あなたがエルドラージの寸借者を唱えたとき、クリーチャー１体を対象とする。あなたは(１)(◇)を支払ってもよい。そうしたなら、ターン終了時まで、そのクリーチャーのコントロールを得る。それをアンタップする。ターン終了時まで、それは速攻を得る。（(◇)は無色マナを表す。）速攻","Devoid （This card has no color.）When you cast Eldrazi Obligator, you may pay {1}{C}. If you do, gain control of target creature until end of turn, untap that creature, and it gains haste until end of turn. （{C} represents colorless mana.）Haste",3/1,-,,"Jason Felix","レア, ゲートウォッチの誓い (96/184) ",-
"制止エルドラージ/Immobilizer Eldrazi （せいしえるどらーじ） ","(１)(赤)","クリーチャー — エルドラージ(Eldrazi)・ドローン(Drone) ","欠色（このカードは無色である。）(２)(◇)：このターン、タフネスがパワーより大きいクリーチャーではブロックできない。（(◇)は無色マナを表す。）","Devoid （This card has no color.）{2}{C}: Each creature with toughness greater than its power can't block this turn. （{C} represents colorless mana.）",2/1,-,,"Svetlin Velinov","アンコモン, ゲートウォッチの誓い (97/184) ",-
"コジレックの帰還/Kozilek's Return （こじれっくのきかん） ","(２)(赤)","インスタント ","欠色（このカードは無色である。）コジレックの帰還は各クリーチャーにそれぞれ２点のダメージを与える。あなたが点数で見たマナ・コストが７以上のエルドラージ(Eldrazi)・クリーチャー呪文を１つ唱えるたび、あなたはあなたの墓地からコジレックの帰還を追放してもよい。そうしたなら、コジレックの帰還は各クリーチャーにそれぞれ５点のダメージを与える。","Devoid （This card has no color.）Kozilek's Return deals 2 damage to each creature.Whenever you cast an Eldrazi creature spell with converted mana cost 7 or greater, you may exile Kozilek's Return from your graveyard. If you do, Kozilek's Return deals 5 damage to each creature.",-,-,,"Lius Lasahido","神話レア, ゲートウォッチの誓い (98/184) ",-
"コジレックの大口/Maw of Kozilek （こじれっくのおおぐち） ","(３)(赤)","クリーチャー — エルドラージ(Eldrazi)・ドローン(Drone) ","欠色（このカードは無色である。）(◇)：ターン終了時まで、コジレックの大口は+2/-2の修整を受ける。（(◇)は無色マナを表す。）","Devoid （This card has no color.）{C}: Maw of Kozilek gets +2/-2 until end of turn. （{C} represents colorless mana.）",2/5,-,,Daarken,"コモン, ゲートウォッチの誓い (99/184) ",-
"現実の流出/Reality Hemorrhage （げんじつのりゅうしゅつ） ","(１)(赤)","インスタント ","欠色（このカードは無色である。）クリーチャー１体かプレイヤー１人を対象とする。現実の流出はそれに２点のダメージを与える。","Devoid （This card has no color.）Reality Hemorrhage deals 2 damage to target creature or player.",-,-,,"Chris Rallis","コモン, ゲートウォッチの誓い (100/184) ",-
"アクームの炎探し/Akoum Flameseeker （あくーむのほのおさがし） ","(２)(赤)","クリーチャー — 人間(Human)・シャーマン(Shaman)・同盟者(Ally) ","盟友 ― (Ｔ),あなたがコントロールするアンタップ状態の同盟者(Ally)を１体タップする：カードを１枚捨てる。そうしたなら、カードを１枚引く。","Cohort --- {T}, Tap an untapped Ally you control: Discard a card. If you do, draw a card.",3/2,-,,"Willian Murai","コモン, ゲートウォッチの誓い (101/184) ",-
"巨岩投下/Boulder Salvo （きょがんとうか） ","(４)(赤)","ソーサリー ","怒涛(１)(赤)（あなたかチームメイトがこのターンに他の呪文を唱えていたなら、あなたはこの呪文を怒涛コストで唱えてもよい。）クリーチャー１体を対象とする。巨岩投下はそれに４点のダメージを与える。","Surge {1}{R} （You may cast this spell for its surge cost if you or a teammate has cast another spell this turn.）Boulder Salvo deals 4 damage to target creature.",-,-,,"Vincent Proce","コモン, ゲートウォッチの誓い (102/184) ",-
"凶暴な力/Brute Strength （きょうぼうなちから） ","(１)(赤)","インスタント ","クリーチャー１体を対象とする。ターン終了時まで、それは+3/+1の修整を受けるとともにトランプルを得る。","Target creature gets +3/+1 and gains trample until end of turn.",-,-,,"Wayne Reynolds","コモン, ゲートウォッチの誓い (103/184) ",-
"炎呼び、チャンドラ/Chandra, Flamecaller （ほのおよびちゃんどら） ","(４)(赤)(赤)","プレインズウォーカー — チャンドラ(Chandra) ","[+1]：速攻を持つ赤の3/1のエレメンタル(Elemental)・クリーチャー・トークンを２体戦場に出す。次の終了ステップの開始時に、それらを追放する。[0]：あなたの手札からカードをすべて捨て、その後その枚数に１を足した枚数のカードを引く。[-X]：炎呼び、チャンドラは各クリーチャーにそれぞれＸ点のダメージを与える。","+1: Put two 3/1 red Elemental creature tokens with haste onto the battlefield. Exile them at the beginning of the next end step.0: Discard all the cards in your hand, then draw that many cards plus one.-X: Chandra, Flamecaller deals X damage to each creature.",-,4,,"Jason Rainville","神話レア, ゲートウォッチの誓い (104/184) ",-
"溶滓のへリオン/Cinder Hellion （ようさいのへりおん） ","(４)(赤)","クリーチャー — ヘリオン(Hellion) ","トランプル溶滓のへリオンが戦場に出たとき、対戦相手１人を対象とする。溶滓のへリオンはそのプレイヤーに２点のダメージを与える。","TrampleWhen Cinder Hellion enters the battlefield, it deals 2 damage to target opponent.",4/4,-,,"Jason Kang","コモン, ゲートウォッチの誓い (105/184) ",-
"食い荒らす炎/Devour in Flames （くいあらすほのお） ","(２)(赤)","ソーサリー ","食い荒らす炎を唱えるための追加コストとして、あなたがコントロールする土地１つをオーナーの手札に戻す。クリーチャー１体かプレインズウォーカー１人を対象とする。食い荒らす炎はそれに５点のダメージを与える。","As an additional cost to cast Devour in Flames, return a land you control to its owner's hand.Devour in Flames deals 5 damage to target creature or planeswalker.",-,-,,"Svetlin Velinov","アンコモン, ゲートウォッチの誓い (106/184) ",-
"怒りの具象化/Embodiment of Fury （いかりのぐしょうか） ","(３)(赤)","クリーチャー — エレメンタル(Elemental) ","トランプルあなたがコントロールする土地・クリーチャーはトランプルを持つ。上陸 ― 土地が１つあなたのコントロール下で戦場に出るたび、あなたがコントロールする土地１つを対象とする。あなたは「ターン終了時まで、それは速攻を持つ3/3のエレメンタル(Elemental)・クリーチャーになる。それは土地でもある。」を選んでもよい。","TrampleLand creatures you control have trample.Landfall --- Whenever a land enters the battlefield under your control, you may have target land you control become a 3/3 Elemental creature with haste until end of turn. It's still a land.",4/3,-,,"David Palumbo","アンコモン, ゲートウォッチの誓い (107/184) ",-
"促進/Expedite （そくしん） ",(赤),"インスタント ","クリーチャー１体を対象とする。ターン終了時まで、それは速攻を得る。カードを１枚引く。","Target creature gains haste until end of turn.Draw a card.",-,-,,"Kieran Yanner","コモン, ゲートウォッチの誓い (108/184) ",-
"巨人の陥落/Fall of the Titans （きょじんのかんらく） ",(Ｘ)(Ｘ)(赤),"インスタント ","怒涛(Ｘ)(赤)（あなたかチームメイトがこのターンに他の呪文を唱えていたなら、あなたはこの呪文を怒涛コストで唱えてもよい。）クリーチャーやプレイヤーを最大２つまで対象とする。巨人の陥落はそれらにそれぞれＸ点のダメージを与える。","Surge {X}{R} （You may cast this spell for its surge cost if you or a teammate has cast another spell this turn.）Fall of the Titans deals X damage to each of up to two target creatures and/or players.",-,-,,"Chris Rallis","レア, ゲートウォッチの誓い (109/184) ",-
"ゴブリンの闇住まい/Goblin Dark-Dwellers （ごぶりんのやみずまい） ","(３)(赤)(赤)","クリーチャー — ゴブリン(Goblin) ","威迫ゴブリンの闇住まいが戦場に出たとき、あなたの墓地から点数で見たマナ・コストが３以下の、インスタント・カード１枚かソーサリー・カード１枚を対象とする。あなたはそれをそのマナ・コストを支払うことなく唱えてもよい。このターンにそのカードがあなたの墓地に置かれるなら、代わりにそれを追放する。","MenaceWhen Goblin Dark-Dwellers enters the battlefield, you may cast target instant or sorcery card with converted mana cost 3 or less from your graveyard without paying its mana cost. If that card would be put into your graveyard this turn, exile it instead.",4/4,-,,"Steven Belledin","レア, ゲートウォッチの誓い (110/184) ",-
"ゴブリンの自在駆け/Goblin Freerunner （ごぶりんのじざいかけ） ","(３)(赤)","クリーチャー — ゴブリン(Goblin)・戦士(Warrior)・同盟者(Ally) ","怒涛(１)(赤)（あなたかチームメイトがこのターンに他の呪文を唱えていたなら、あなたはこの呪文を怒涛コストで唱えてもよい。）威迫（このクリーチャーは２体以上のクリーチャーによってしかブロックされない。）","Surge {1}{R} （You may cast this spell for its surge cost if you or a teammate has cast another spell this turn.）Menace （This creature can't be blocked except by two or more creatures.）",3/2,-,,"Wayne Reynolds","コモン, ゲートウォッチの誓い (111/184) ",-
"カズールの徴収者/Kazuul's Toll Collector （かずーるのちょうしゅうしゃ） ","(２)(赤)","クリーチャー — オーガ(Ogre)・戦士(Warrior) ","(０)：あなたがコントロールする装備品(Equipment)１つを対象とし、それをカズールの徴収者につける。この能力は、あなたがソーサリーを唱えられるときにのみ起動できる。","{0}: Attach target Equipment you control to Kazuul's Toll Collector. Activate this ability only any time you could cast a sorcery.",3/2,-,,"Greg Staples","アンコモン, ゲートウォッチの誓い (112/184) ",-
"チャンドラの誓い/Oath of Chandra （ちゃんどらのちかい） ","(１)(赤)","伝説のエンチャント ","チャンドラの誓いが戦場に出たとき、対戦相手がコントロールするクリーチャー１体を対象とする。チャンドラの誓いはそれに３点のダメージを与える。各終了ステップの開始時に、そのターンにプレインズウォーカーがあなたのコントロール下で戦場に出ていた場合、チャンドラの誓いは各対戦相手にそれぞれ２点のダメージを与える。","When Oath of Chandra enters the battlefield, it deals 3 damage to target creature an opponent controls.At the beginning of each end step, if a planeswalker entered the battlefield under your control this turn, Oath of Chandra deals 2 damage to each opponent.",-,-,,"Wesley Burt","レア, ゲートウォッチの誓い (113/184) ",-
"抑圧的支配/Press into Service （よくあつてきしはい） ","(４)(赤)","ソーサリー ","支援２を行う。（クリーチャーを最大２体対象とし、それらの上に+1/+1カウンターをそれぞれ１個置く。）クリーチャー１体を対象とし、ターン終了時までそれのコントロールを得る。そのクリーチャーをアンタップする。ターン終了時まで、それは速攻を得る。","Support 2. （Put a +1/+1 counter on each of up to two target creatures.）Gain control of target creature until end of turn. Untap that creature. It gains haste until end of turn.",-,-,,"Steve Prescott","アンコモン, ゲートウォッチの誓い (114/184) ",-
"紅蓮術師の突撃/Pyromancer's Assault （ぐれんじゅつしのとつげき） ","(３)(赤)","エンチャント ","あなたが各ターンのあなたの２つ目の呪文を唱えるたび、クリーチャー１体かプレイヤー１人を対象とする。紅蓮術師の突撃はそれに２点のダメージを与える。","Whenever you cast your second spell each turn, Pyromancer's Assault deals 2 damage to target creature or player.",-,-,,"Todd Lockwood","アンコモン, ゲートウォッチの誓い (115/184) ",-
"無謀な奇襲隊/Reckless Bushwhacker （むぼうなきしゅうたい） ","(２)(赤)","クリーチャー — ゴブリン(Goblin)・戦士(Warrior)・同盟者(Ally) ","怒涛(１)(赤)（あなたかチームメイトがこのターンに他の呪文を唱えていたなら、あなたはこの呪文を怒涛コストで唱えてもよい。）速攻無謀な奇襲隊が戦場に出たとき、これの怒涛コストが支払われていた場合、ターン終了時まで、あなたがコントロールする他のクリーチャーは+1/+0の修整を受けるとともに速攻を得る。","Surge {1}{R} （You may cast this spell for its surge cost if you or a teammate has cast another spell this turn.）HasteWhen Reckless Bushwhacker enters the battlefield, if its surge cost was paid, other creatures you control get +1/+0 and gain haste until end of turn.",2/1,-,,"Kieran Yanner","アンコモン, ゲートウォッチの誓い (116/184) ",-
"火花魔道士の計略/Sparkmage's Gambit （ひばなまどうしのけいりゃく） ","(１)(赤)","ソーサリー ","クリーチャーを最大２体対象とする。火花魔道士の計略はそれらにそれぞれ１点のダメージを与える。このターン、それらではブロックできない。","Sparkmage's Gambit deals 1 damage to each of up to two target creatures. Those creatures can't block this turn.",-,-,,"Mathias Kollros","コモン, ゲートウォッチの誓い (117/184) ",-
"ヴァラクートの涙/Tears of Valakut （う゛ぁらくーとのなみだ） ","(１)(赤)","インスタント ","ヴァラクートの涙は呪文や能力によっては打ち消されない。飛行を持つクリーチャー１体を対象とする。ヴァラクートの涙はそれに５点のダメージを与える。","Tears of Valakut can't be countered by spells or abilities.Tears of Valakut deals 5 damage to target creature with flying.",-,-,,"Noah Bradley","アンコモン, ゲートウォッチの誓い (118/184) ",-
"ヴァラクートの暴君/Tyrant of Valakut （う゛ぁらくーとのぼうくん） ","(５)(赤)(赤)","クリーチャー — ドラゴン(Dragon) ","怒涛(３)(赤)(赤)（あなたかチームメイトがこのターンに他の呪文を唱えていたなら、あなたはこの呪文を怒涛コストで唱えてもよい。）飛行ヴァラクートの暴君が戦場に出たとき、これの怒涛コストが支払われていた場合、クリーチャー１体かプレイヤー１人を対象とする。ヴァラクートの暴君はそれに３点のダメージを与える。","Surge {3}{R}{R} （You may cast this spell for its surge cost if you or a teammate has cast another spell this turn.）FlyingWhen Tyrant of Valakut enters the battlefield, if its surge cost was paid, it deals 3 damage to target creature or player.",5/4,-,,"Tyler Jacobson","レア, ゲートウォッチの誓い (119/184) ",-
"ザダの猛士/Zada's Commando （ざだのもうし） ","(１)(赤)","クリーチャー — ゴブリン(Goblin)・射手(Archer)・同盟者(Ally) ","先制攻撃盟友 ― (Ｔ),あなたがコントロールするアンタップ状態の同盟者(Ally)を１体タップする：対戦相手１人を対象とする。ザダの猛士はそのプレイヤーに１点のダメージを与える。","First strikeCohort --- {T}, Tap an untapped Ally you control: Zada's Commando deals 1 damage to target opponent.",2/1,-,,"Zack Stella","コモン, ゲートウォッチの誓い (120/184) ",-
"産み落とす巨体/Birthing Hulk （うみおとすきょたい） ","(６)(緑)","クリーチャー — エルドラージ(Eldrazi)・ドローン(Drone) ","欠色（このカードは無色である。）産み落とす巨体が戦場に出たとき、あなたは無色の1/1のエルドラージ(Eldrazi)・末裔(Scion)クリーチャー・トークンを２体戦場に出す。それらは「このクリーチャーを生け贄に捧げる：あなたのマナ・プールに(◇)を加える。」を持つ。（(◇)は無色マナを表す。）(１)(◇)：産み落とす巨体を再生する。","Devoid （This card has no color.）When Birthing Hulk enters the battlefield, put two 1/1 colorless Eldrazi Scion creature tokens onto the battlefield. They have ""Sacrifice this creature: Add {C} to your mana pool."" （{C} represents colorless mana.）{1}{C}: Regenerate Birthing Hulk.",5/4,-,,"Jack Wang","アンコモン, ゲートウォッチの誓い (121/184) ",-
